<?xml version="1.0" encoding="UTF-8"?>
<AudioCatalog 
        xmlns="http://skuniv.ac.kr/cs/yoon/audio" 
        xmlns:xsi="http://www.w3.org/2001/XMLSchema-instance" 
        xsi:schemaLocation="http://skuniv.ac.kr/cs/yoon/audio ex4-7.xsd">

    <Cd>
        <Artist>홍길동</Artist>
        <Title>오늘</Title>
        <Genre>재즈</Genre>
        <Released-date>2020-10-14</Released-date>
        <Song>
            아침밥
            <playTime>
                <hours>0</hours>
                <minutes>3</minutes>
                <seconds>30</seconds>
            </playTime>
        </Song>
        <Song>
            점심의 커피
            <playTime>
                <hours>0</hours>
                <minutes>4</minutes>
                <seconds>27</seconds>
            </playTime>
        </Song>
    </Cd>

    <Cassette>
        <Artist>메론</Artist>
        <Title>OurLove</Title>
        <Genre>락</Genre>
        <Released-date>2010-10-14</Released-date>
        <Song>
            Paint
            <playTime>
                <hours>0</hours>
                <minutes>7</minutes>
                <seconds>20</seconds>
            </playTime>
        </Song>

        <Song>
            Favor
            <playTime>
                <hours>0</hours>
                <minutes>3</minutes>
                <seconds>45</seconds>
            </playTime>
        </Song>
    </Cassette>

    <Mp3>
        <Artist>찰리</Artist>
        <Title>Alone</Title>
        <Genre>발라드</Genre>
        <Released-date>2020-01-01</Released-date>
        <Song>
            You're so beautiful
            <playTime>
                <hours>0</hours>
                <minutes>7</minutes>
                <seconds>59</seconds>
            </playTime>
        </Song>
    </Mp3>

    <Record>
        <Artist>다니엘 리</Artist>
        <Title>Salary Man</Title>
        <Genre>클래식</Genre>
        <Released-date>2008-01-23</Released-date>
        <Song>
            빛나는 강
            <playTime>
                <hours>1</hours>
                <minutes>2</minutes>
                <seconds>22</seconds>
            </playTime>
        </Song>
    </Record>
</AudioCatalog>